pub_date	category	title	venue	authors	excerpt	citation	url_slug	paper_url	doi
2020-10-15	manuscripts	Diffusion histology imaging combining diffusion basis spectrum imaging (DBSI) and machine learning improves detection and classification of glioblastoma pathology	Clinical Cancer Research	Zezhong Ye; Richard L. Price; Xiran Liu; Joshua Lin; Qingsong Yang; Peng Sun; Anthony T. Wu; Liang Wang; Rowland H. Han; Chunyu Song; Ruimeng Yang; Sam E. Gary; Diane D. Mao; Michael Wallendorf; Jian L. Campian; Jr-Shin Li; Sonika Dahiya; Albert H. Kim; Sheng-Kwei Song 		Ye, Z., Price, R. L., Liu, X., Lin, J., Yang, Q., Sun, P., ... & Song, S. K. (2020). "Diffusion histology imaging combining diffusion basis spectrum imaging (DBSI) and machine learning improves detection and classification of glioblastoma pathology." <i>Clinical Cancer Research</i>, 26(20), 5388-5399.	diffusion2020		10.1158/1078-0432.CCR-20-0736
2022-08-30	manuscripts	Deconvoluting complex correlates of COVID-19 severity with a multi-omic pandemic tracking strategy	Nature Communications			Parikh, V. N., Ioannidis, A. G., Jimenez-Morales, D., Gorzynski, J. E., De Jong, H. N., Liu, X., ... & Ashley, E. A. (2022). "Deconvoluting complex correlates of COVID-19 severity with a multi-omic pandemic tracking strategy." <i>Nature Communications</i>, 13(1), 5107..	deconvoluting2022		10.1038/s41467-022-32397-8
2024-01-01	manuscripts	Clumppling: cluster matching and permutation program with integer linear programming	Bioinformatics		Liu, X., Kopelman, N. M., & Rosenberg, N. A. (2024). "Clumppling: cluster matching and permutation program with integer linear programming." <i>Bioinformatics</i>, 40(1), btad751.	clumppling2024	https://xr-cc.github.io/files/LiuEtAl2024Clumppling.pdf	10.1093/bioinformatics/btad751
2024-09-30	preprints	Combinatorics of a dissimilarity measure for pairs of draws from discrete probability vectors on finite sets of objects	arXiv			Ahsan, Z., Liu, X., & Rosenberg, N. A. (2024). "Combinatorics of a dissimilarity measure for pairs of draws from discrete probability vectors on finite sets of objects." <i>arXiv preprint</i>.	combinatorics2024		10.48550/arXiv.2410.00221
2025-04-25	conferences	ML-MAGES: A Machine Learning Framework for Multivariate Genetic Association Analyses with Genes and Effect Size Shrinkage	Research in Computational Molecular Biology			Liu, X., Crawford, L., & Ramachandran, S. (2025, April). "ML-MAGES: A machine learning framework for multivariate genetic association analyses with genes and effect size shrinkage." In <i>International Conference on Research in Computational Molecular Biology</i> (pp. 321-324). Cham: Springer Nature Switzerland.	mlmages2025		10.1007/978-3-031-90252-9_31